{
  "$schema": "http://json-schema.org/draft-07/schema#",
  "title": "Locations",
  "type": "array",
  "items": {
    "type": "object",
    "required": ["id", "name", "address"],
    "properties": {
      "id": { "type": "string" },
      "name": { "type": "string" },
      "address": {
        "type": "object",
        "required": ["display"],
        "properties": {
          "display": { "type": "string" },
          "street": { "type": "string" },
          "city": { "type": "string" },
          "state": { "type": "string" },
          "postalCode": { "type": "string" },
          "country": { "type": "string" }
        }
      },
      "phone": { "type": "string" },
      "hours": {
        "type": "object",
        "patternProperties": {
          "^[a-zA-Z]+$": { "type": "string" }
        }
      },
      "notes": { "type": "string" },
      "mapUrl": { "type": "string", "format": "uri" },
      "lat": { "type": "number" },
      "lng": { "type": "number" }
    }
  }
}